company_name,also_known_as,hq_city,hq_country,founded_year,primary_layer,secondary_layers,vertical_subcategory,core_or_division,one_liner,total_funding_usd,last_round_size_usd,last_round_type,last_round_date,last_round_lead,team_size,source_url,verification,entity_type,status,notes,business_model,customers,revenue_status,technical_differentiation
OLO Robotics,OLO; formerly BOW (Bettering Our Worlds),Sheffield,GB,2020,L5_middleware,L2_simulation,,core,"Browser-based accessibility layer over ROS 2 giving non-roboticist developers cloud simulation, AI-assisted coding, visualization, and sim-to-real deployment without in-house ROS2 expertise.",~5320000,~5000000,seed,2025-01,undisclosed,~27,https://www.roboticstomorrow.com/news/2026/05/19/olo-robotics-completes-commercial-launch-with-three-international-manufacturing-and-distribution-partnerships-/26581/,verified,company,active,"Sheffield UK startup, formerly BOW (Bettering Our Worlds), founded March 2020 by Daniel Camilleri; rebranded OLO ('óloi' = everyone). Raised £4m (~€4.7m / ~$5.0M) seed early 2025; PitchBook lists ~$5.32M total across 11 investors (Anticus Partners, Finance Yorkshire, Northern Gritstone, Pxn Ventures, SyndicateRoom). Lead investor not clearly disclosed. Pivoted from proprietary universal-robotics architecture to ROS2-based platform. Commercial launch May 2026 with distribution/manufacturing partners Deep Robotics, inMotion Robotic, and Fiction Lab (LEO Rover bundle). L5 software stack/middleware sitting between policy/code and robot execution; secondary L2 via cloud simulation. In_scope=true: AI-native (AI-assisted programming + sim-to-real deployment) developer platform for the robot-learning ecosystem, though core value is ROS2 accessibility tooling. Company UK reg no. 12516316 (OLO ROBOTICS LTD). Round size in USD approximate from £4m/€4.7m FX.","Seat-based SaaS subscription to the OLO browser-based ROS 2 platform: Free tier, Standard (£23/seat/mo or £275/yr), Premium (£69/seat/mo or £825/yr), and custom Enterprise, plus usage-based add-ons (cloud simulator £2/hr, AI tokens, storage £2.50/GB). Secondary channel is OEM/hardware bundling, where robot manufacturers and distributors offer OLO as an optional bundle with their hardware (e.g., Fiction Lab's LEO Rover ordered with OLO).","Commercial launch (May 2026) named three manufacturing/distribution partners: Deep Robotics (China), inMotion Robotic (Germany), and Fiction Lab (Poland). Website also lists Sarcomere Dynamics and Production Park; University of Nottingham cited as an academic user. Distinction between paying vs. piloting/distribution partners is not publicly broken out.",early-revenue (no public revenue/ARR figure disclosed; raised ~£4M / €4.7M / ~$5.3M seed Jan 2025 led by Northern Gritstone),"Positions as a fully browser-based, zero-install accessibility layer over ROS 2 (cloud sim, AI-assisted coding, JS/Python SDKs, sim-to-real) aimed at non-roboticist developers, versus The Construct (cloud ROS development/learning environment) and Foxglove (ROS visualization/observability) which each cover only part of the stack; OLO bundles dev environment, simulation, visualization, and deployment plus an OEM hardware-bundling go-to-market. Differentiation is more on integrated breadth and ease-of-onboarding than a defensible technical moat."
Polymath Robotics,Polymath,San Francisco,US,2021,L5_middleware,"L2_simulation,L6_vertical",,core,"Plug-and-play autonomy software stack (AI/ML, controls, ROS, safety) letting industrial off-highway vehicles drive themselves, commandable via a simple REST API.",~500000,~500000,Pre-Seed,2022-06,Y Combinator,~11,https://www.polymathrobotics.com/,verified,company,active,"YC S22. Co-founded 2021 by Stefan Seltz-Axmacher (CEO, ex-Starsky Robotics) and Ilia Baranov. L5 horizontal autonomy middleware: bundles AI/ML, controls, ROS, safety, deployment as a plug-and-play stack commandable via REST API, sold to robot/vehicle makers rather than being a vehicle itself. Provides a simulation tool, Caladan (L2 secondary), for building/testing autonomous behaviors before physical deployment; serves verticals like agriculture, mining, construction, defense (L6 secondary). Borderline AV-adjacent (industrial-vehicle autonomy) but kept in_scope=true because the product is a horizontal learned-autonomy software layer, not an autonomous vehicle. Total disclosed funding ~$500K; most recent disclosed round a pre-seed/seed dated 2022-06 (Crunchbase) around YC participation; investors include Y Combinator, TRAC, Samsara Ventures, Pioneer Fund, Liquid 2 Ventures, Zillionize. Team size ~11 (Latka/Tracxn estimates). Round size/type labeling varies across sources (pre-seed vs seed).","Sells a hardware- and OEM-agnostic autonomy software stack (""Caladan"" simulation tool plus ~40 Autonomous Navigation Modules covering path planning, hazard/human detection, controls and safety) that customers retrofit onto or integrate into industrial off-highway vehicles; revenue is recurring software/licensing (SaaS-style subscription plus integration), sold to OEMs and fleet operators rather than per-vehicle hardware. Specific list pricing is not publicly disclosed.","Specific named customers are largely undisclosed; the company describes its buyers as top off-highway OEMs, ""billion-dollar"" fleet operators, and U.S. government/defense programs across agriculture, mining, construction and delivery robotics. No individually named paying logo is publicly confirmed.","early-revenue (~$1.7M ARR as of mid-2024, per Latka; unverified)","Differentiates as a vehicle- and hardware-agnostic, plug-and-play ""general autonomy"" middleware (ROS-based, simulation-first via Caladan) that lets OEMs add autonomy without building an internal AV team, versus vertically integrated off-highway autonomy rivals like Forterra (formerly Robotic Research) and Outrider, which deliver full application-specific autonomous systems rather than a portable middleware stack."
Rapyuta Robotics,rapyuta.io,Tokyo,JP,2014,L5_middleware,L6_vertical,,core,"Cloud-robotics middleware (rapyuta.io) orchestrating multi-robot fleets — localization, motion planning, task assignment, route planning — across hardware-agnostic warehouse robots; also builds own PA-AMR, ASRS, and forklift robots.",~81000000,51000000,Series C,2022-04,Goldman Sachs,270+,https://www.rapyuta-robotics.com/about/,verified,company,active,"L5 cloud-robotics middleware (rapyuta.io): hardware-agnostic full-stack DevOps platform for cloud-connected robot fleets, spun from ETH Zurich / RoboEarth EU project. HQ Tokyo (Koto-ku); additional offices Osaka, Chennai (India), Chicago (USA). Founded July 2, 2014. Total raised ~JPY 10B (~$81M) across 7 rounds. Latest equity round: Series C, $51M (JPY 6.4B), led by Goldman Sachs, announced April 2022; subsequent debt/loan financing (BOT Lease 2024, UPSIDER Capital 2026 per third-party trackers, undisclosed amounts). Team 270+ (2026). Secondary L6 via own warehouse robots: PA-AMR (pick-assist AMR), ASRS, autonomous forklift — vertical 6a_warehouse. in_scope=true: the multi-robot orchestration/middleware layer is AI-native robotics infra and warehouse AMR fleet coordination would not exist as a category without robot-fleet intelligence; though core orchestration leans classical planning rather than learned policies.","Sells warehouse automation built on its rapyuta.io cloud-robotics middleware: flagship pick-assist AMRs (PA-AMR) and an ASRS, primarily under a Robots-as-a-Service (RaaS) subscription model with zero-upfront-cost options and an ""ROI guarantee"" tying fees to productivity targets, plus hardware sales, software licensing, and integration/consultancy services. Buyers are logistics operators (3PLs, e-commerce, manufacturing), with partner integrators like SVT Robotics extending reach.","Named: ASKUL Corporation / ASKUL LOGIST (LOHACO e-commerce fulfillment, 34 + 12 PA-AMRs across Saitama and western Japan hubs), Nestlé Japan (end client at an ASKUL LOGIST center), and Nippon Express (early pick-assist pilot, a top Japanese 3PL). Strong PA-AMR share in the Japanese warehouse market.","scaling (~$38M revenue 2025, third-party estimate, unverified; ~$81-91M total funding raised incl. $51M Series C led by Goldman Sachs)","Unlike pure fleet-ops/observability middleware peers InOrbit and Formant (ex-Freedom Robotics), Rapyuta couples its rapyuta.io cloud platform (cloud-offloaded localization, motion/route planning, task assignment, multi-robot orchestration) with its own AMR/ASRS hardware delivered as RaaS, making it a vertically integrated warehouse solution rather than a hardware-agnostic software layer. ETH Zurich/RoboEarth research lineage underpins the cloud-robotics stack."
Rerun,"Rerun.io, Rerun GmbH",Stockholm,SE,2022,L5_middleware,L3_data_infra,,core,"Open-source visualization and a purpose-built database/cloud platform for Physical AI, managing multimodal robot data (video, 3D scenes, tensors) for robotics, drones and AVs.",20200000,17000000,seed,2025-03,Point Nine,60,https://techcrunch.com/2025/03/20/reruns-open-source-ai-platform-for-robots-drones-and-cars-revs-up-with-17m-seed/,verified,company,active,"HQ Stockholm, Sweden (SE) with distributed team across US/Europe; legal entity also registered as Rerun GmbH (Germany). Founded 2022 by Emil Ernerfeldt (CTO, creator of egui), Moritz Schiebold, Nikolaus West. $17M seed (Mar 2025) led by Point Nine, with Sunflower Capital, Costanoa Ventures, Seedcamp; angels Guillermo Rauch (Vercel), Eric Jang (1X), Oliver Cameron (Odyssey), Wes McKinney (Apache Arrow/pandas), Nicolas Dessaigne (YC). Total funding $20.2M. Primary layer L5 middleware/observability (robotics visualization + SDK); strong overlap with L3 data infra (database/cloud platform for robot data). In scope: AI-native data/observability tooling for Physical AI; not a standalone product that exists without AI workflows. Visualizations used in open-source projects by Meta, Google, Hugging Face, Unitree.","Open-core: the Rerun SDKs and Viewer for multimodal robot data visualization are free (MIT/Apache 2.0), while monetization comes from a commercial, cloud-hosted database/data platform purpose-built for Physical AI (ingesting, storing, querying video/3D/tensor data), sold to robotics, drone, and AV teams. As of 2025 the commercial product was in development with select design partners; pricing is expected to be a subscription/usage-based cloud model but specifics are not publicly disclosed.","Named paying customers for the commercial cloud are undisclosed (it was in private partner/development phase). The open-source tool is used/integrated by Meta, Google, Hugging Face, and Unitree, and adopted broadly across robotics and AV teams, but these are open-source users rather than confirmed paying accounts.","early-revenue (~$7.5M revenue 2025, third-party estimate via GetLatka, unverified)","Differentiated as a Physical-AI-native data stack: a single open-source visualizer/SDK plus a from-scratch database/cloud optimized for time-aligned multimodal robot data (video, 3D scenes, tensors), versus general experiment/MLOps tooling like Weights & Biases and Foxglove. Closest competitor Foxglove targets robotics observability/visualization (ROS-centric); Rerun extends beyond visualization into a purpose-built storage/query database layer."
robolaunch,Robolaunch,Ankara,TR,2020,L5_middleware,"L2_simulation,L3_data_infra",,core,"Kubernetes-native open-source cloud robotics platform to develop, simulate, deploy, and orchestrate ROS/ROS2 robots and GPU-accelerated AI across cloud, edge, and real hardware.",1500000,undisclosed,Seed,unknown,Turkey Development Fund,~6,https://github.com/robolaunch/robolaunch,verified,company,active,"L5 middleware: Kubernetes-native cloud robotics platform (RoboKube; arxiv 2403.04440) providing orchestration/deployment plane between robot software (ROS/ROS2) and execution on cloud/edge/real hardware; secondary L2 (cloud simulation) and L3 (GPU-as-a-Service, Cloud IDE, data infra). Founded 2020, HQ Ankara, Turkey. Total funding ~$1.5M per Crunchbase/Lucidity; investors include Turkey Development Fund and Simya; exact round size/date undisclosed. Team ~6 (Crunchbase). Company has pivoted emphasis toward industrial Vision AI / GPU infrastructure for manufacturing but underlying platform remains cloud-native robot orchestration. In scope: AI-native cloud robotics/middleware stack enabling distributed robot learning and GPU-accelerated AI workloads. Sources: github.com/robolaunch, robolaunch.io, crunchbase.com/organization/robolaunch, lucidityinsights.com, arxiv.org/html/2403.04440v1.","B2B sales of ""robolaunch Vision AI"" / robolaunch VIA — inline surface-defect inspection systems (Press, Body, Paint, Final Assembly) layered on robolaunch's Kubernetes-native AI Infrastructure — to automotive/industrial manufacturers via custom-quote deployment and managed-service contracts (no public list pricing). The underlying cloud robotics platform and Kubernetes Robot Operator remain open-source, serving as a funnel/foundation rather than the primary revenue line.","Undisclosed by name; the company cites ""20+ Vision AI in Production"" and live automotive surface-inspection deployments (Press/Body/Paint/Final Assembly) but its case-studies page lists no named customers (""coming soon""). No specific named paying org is publicly findable.","early-revenue (no public revenue/ARR figure disclosed; total funding ~$1.5M from Türkiye Development Fund and Simya, unverified)","vs Cogniac (~$8.8M ARR, $40.7M raised) and Landing AI, robolaunch differentiates by coupling vision inspection with a Kubernetes-native, open-source cloud-robotics stack (Robot Operator, multicluster GPU orchestration, ROS/ROS2) spanning cloud and edge, rather than offering inspection as a standalone SaaS — and by a regional/automotive-OEM focus out of Turkey. Otherwise it is a small, late-entrant challenger competing largely on execution and capital against better-funded vision-AI incumbents."
Robot Ops,TraceHouse; ROSQL; RobotOpsInc; robotops.com,Englewood Cliffs,US,unknown,L5_middleware,L3_data_infra,,core,Real-time observability for production ROS2 robot fleets; an agent streams telemetry into an index queried via ROSQL plus an AI debugging assistant that root-causes failures.,undisclosed,undisclosed,undisclosed,unknown,undisclosed,unknown,https://www.robotops.com/,incomplete,company,active,"L5 observability/monitoring/debugging middleware for deployed robot fleets. TraceHouse agent installs on ROS2 robots (Humble/Jazzy/Kilted) in one command, no source changes, and streams LiDAR/cameras/pose/kinematics into an index; ROSQL (SQL-like query language, OpenTelemetry-based, available as library/CLI/gRPC/WASM) plus a natural-language AI debugging partner grounded in live telemetry surfaces evidence and root-causes failures. Robot-native: ingests URDF/XACRO, understands kinematics, actions, topic graph. GitHub org RobotOpsInc (rmw_robotops custom RMW for distributed tracing) and rosql.org confirm the product. HQ: 560 Sylvan Ave Suite 3160, Englewood Cliffs, NJ (NY metro). SCOPE: ROS2 fleet observability is partly non-AI infra, but the differentiated product is the AI debugging/root-cause assistant over deployed robot behavior — flagged borderline, kept in_scope=true. Founding year, team size, and funding not publicly disclosed (no Crunchbase/news funding record found), so verification=incomplete despite confirmed company and one-liner sources.","B2B SaaS sold per-robot/month for the TraceHouse observability platform, bought by robotics/ROS2 engineering teams operating production fleets; tiers are Starter, Professional, and Enterprise with included storage and data-retention windows (7/14/30 days), a 14-day free trial, and 15-20% discounts for 1-3 year commitments. Enterprise adds SSO, white-labeling, SLAs, and custom contracts negotiated via sales with invoicing.","Undisclosed. The site shows only generic deployment archetypes (warehouse AMR fleet of 100+ robots, autonomous delivery, manufacturing robotic arms), with no named paying or piloting organizations publicly findable.",early-revenue (no public revenue or ARR figure disclosed),"Differentiates from Foxglove and Roboto.ai (the closest ROS2 data/observability platforms) by being OpenTelemetry-native distributed tracing plus a purpose-built SQL-like query language (ROSQL) with first-class ROS2 semantics: nodes, actions, topics, named joints, URDF/XACRO-aware component naming, ParentSpanId message causality, and auto unit conversion. Versus Foxglove/Roboto's emphasis on multimodal log visualization and dataset curation, Robot Ops centers on live queryable telemetry plus a telemetry-grounded AI debugging assistant that drafts ROSQL and traces root cause."
Robotair,robotair.io,Stuttgart,DE,2023,L5_middleware,L3_data_infra,,core,"DevOps/CI-CD platform for ROS-powered robots: containerized OTA deployment, monitoring, and scaling so shipping robot apps feels like pushing a web app live.",undisclosed,undisclosed,unknown,unknown,unknown,2-10,https://robotair.io/,verified,company,active,"L5 RobOps/DevOps middleware. Continuous-deployment and observability layer for ROS robots (OTA updates, CI/CD, containerized cloud-native workflows). Positions itself as ""Vercel/GitHub Actions for robots."" HQ Stuttgart, Germany (DE) per LinkedIn; founded 2023; team 2-10. No funding round disclosed (Crunchbase profile exists but no announced raise found via search; Crunchbase page returned 403 to automated fetch) — likely pre-seed/bootstrapped; mark total_funding and round details as undisclosed/unknown, verify at GATE. In_scope=true: this is robot-learning-adjacent middleware (the deployment/observability layer for robots running learned software); it is AI-native infra in the sense that it serves the modern ML-driven robotics stack rather than a pre-AI product category. Note ai_intensity caveat: Robotair does not itself ship a learned policy.","B2B SaaS: a cloud-hosted ""Auto DevOps"" platform (robotair.io) sold to robotics companies / ROS engineering teams, who pay subscription fees to deploy, monitor, OTA-update and scale ROS/ROS 2 robot applications via containerized CI/CD pipelines. Specific pricing tiers (likely per-robot/per-fleet subscription) are not publicly disclosed.","Undisclosed. No named paying or piloting organizations appear in the company website, blog, LinkedIn, or Crunchbase profile; the product targets ROS-based robotics startups and fleet operators.",early-revenue (no public revenue or ARR figure findable; small early-stage startup with no disclosed funding rounds on Crunchbase),"Positions itself as a ROS-native, fully managed CI/CD + OTA + monitoring stack (""push robot apps like a web app""), competing most directly with Airbotics (open-source Uptane-based ROS 2 deployment platform) and broader fleet-ops players like Formant and Transitive/Rapyuta Robotics. Differentiation is its end-to-end managed Docker-build-to-OTA-to-monitoring pipeline rather than self-hosted/open-source tooling, but the edge is largely execution-based and not clearly defensible vs. Airbotics/Formant."
RovifyLab,Rovify Fleet OS; Rovify Lab,Seoul,KR,unknown,L5_middleware,L3_data_infra,,core,"AI operating layer letting anyone deploy, orchestrate and manage heterogeneous robot fleets via natural language, spanning on-robot SLAM to cloud orchestration.",undisclosed,undisclosed,unknown,unknown,unknown,unknown,https://rovifylab.com/,incomplete,company,active,"Early-stage robotics middleware startup. Founders: Dr. Chanoh Park (Founder/CEO, 13+ yrs SLAM/spatial-AI, Korea-based, ex-GroundProbe/EasyRobotics, 2nd place DARPA SubT Challenge) and Samuel Lee (CTO, contact samuel.lee@rovifylab.com). Site lists presence in Seoul, Sydney, and Tokyo; primary HQ inferred as Seoul (KR) given founder base — not explicitly confirmed. Product: Fleet OS — natural-language mission creation that generates/validates/dispatches robot tasks; modular controller architecture validated across 3+ robot OEMs; proprietary SLAM stack for GPS-denied environments proven in underground mining. AI-native: natural-language orchestration layer sitting between policies and real-world fleet execution; would not exist without learned/LLM-driven planning => in_scope=true (Layer 5 middleware, with data-infra/spatial-map aspects). Founding year, funding, total funding, and team size not found in any public source (no Crunchbase/LinkedIn company page located) => verification=incomplete. No invented values.","Sells ""Fleet OS,"" a software/middleware layer that orchestrates heterogeneous robot fleets via natural language, sold to enterprise robot operators (primarily mining/industrial) under multi-year technology partnership contracts. Specific pricing (per-robot, subscription, or platform license) is not publicly disclosed; deployment is described as a SaaS-style operating layer spanning on-robot SLAM to cloud orchestration.","One named-but-anonymized strategic partner: a ""Fortune Global 500 mining services company"" with a multi-year technology partnership (used as the underground-mining beachhead). Validation done across 3+ unnamed robot OEM manufacturers. No specifically named paying customers are public; otherwise undisclosed.","early-revenue (no public revenue or ARR figure disclosed; inferred from active multi-year mining partnership contract, but no dollar figure findable)","Differentiates via a proprietary GPS-denied/infrastructure-free SLAM stack (founder Dr. Chanoh Park, DARPA SubT Challenge 2nd place) combined with an LLM natural-language mission layer and a modular OEM-agnostic controller, spanning on-robot SLAM up to cloud orchestration. Versus InOrbit.AI and Boston Dynamics Orbit (closest fleet-orchestration competitors), Rovify's edge is owning the on-robot localization/mapping layer plus natural-language tasking rather than being a cloud-only management dashboard."
Saphira AI,Saphira,San Francisco,US,2024,L5_middleware,,,core,"AI software that helps hardware makers (robots, heavy machinery) achieve and maintain functional-safety certification by auto-generating HARAs, FMEAs, safety cases, and compliance reports.",500000,500000,Pre-Seed,2024-09,Y Combinator,8,https://www.ycombinator.com/companies/saphira-ai,verified,company,active,"YC S24 batch. Founders Akshay Chalana (CEO) and Oscar Avatare; backgrounds at Tesla, Apple, Amazon, Twitter/Meta. Pre-seed $500K, 2024-09-25, per Crunchbase (Y Combinator standard investment). HQ San Francisco, ~8 employees. Positions as 'enablement/safety layer for Physical AI' and 'Vanta for hardware,' covering ISO 26262, ISO 10218, IEC 61508, UL, CE, TUV. BORDERLINE SCOPE: this is compliance-automation/safety-engineering middleware, not an on-robot learned-policy runtime — the broad category (safety certification) predates AI. Marked in_scope=true per 'when in doubt' rule because it is AI-native tooling specifically targeting safety/assurance of learned-policy physical-AI systems (humanoids, industrial robots). Layer 5 (software stack/middleware), vertical 6h_other. Adjacent to runtime guardrails but operates at the engineering/assurance layer rather than as an on-robot monitor.","B2B SaaS subscription: Saphira's compliance platform auto-generates traceable safety/cybersecurity artifacts (HARA, TARA, FMEA) and standards-aligned reports (ISO 26262, ISO 10218, IEC 61508, ISO/SAE 21434) for hardware engineering teams, sold as seat/team-based subscriptions to robotics, heavy-machinery, automotive, and aerospace makers needing certification from notified bodies (TUV, UL, CE). Specific pricing tiers are not publicly disclosed.","Named users include 1X Technologies (humanoid robot compliance) and RobCo (achieved ISO 10218-1 certification using Saphira); broader customer base spans industrial robotics startups, hardware/retail UL-certification needs, and aerospace/defense firms.","early-revenue (no public ARR/revenue figure found; YC S24, raised ~$500K pre-seed Sept 2024 led by Y Combinator)","Positions as ""Vanta for hardware,"" differentiating from horizontal SaaS-compliance tools (Vanta, Drata) by targeting physical-product functional-safety standards rather than SOC 2/security, and using AI to auto-generate engineering safety analyses (HARA/FMEA/TARA) from design docs. Closest direct competitor is RoboCred (AI-native hardware compliance services); Saphira differentiates via a self-serve software platform with requirements-to-test traceability versus a services model."
