company_name,also_known_as,hq_city,hq_country,founded_year,primary_layer,secondary_layers,vertical_subcategory,core_or_division,one_liner,total_funding_usd,last_round_size_usd,last_round_type,last_round_date,last_round_lead,team_size,source_url,verification,entity_type,status,notes,business_model,customers,revenue_status,technical_differentiation
GelSight,Digit 360 (with Meta AI),"Waltham, Massachusetts",US,2011,L4_hardware,L6_vertical,,core,"Builds high-resolution optical/vision-based tactile sensors that digitize touch at micron scale, co-developing Digit 360 with Meta AI to train AI robotic manipulation policies.",16200000,10000000,Series B,2020-01,Anzu Partners,unknown,https://www.gelsight.com/gelsight-and-meta-ai-introduce-digit-360-tactile-sensor/,verified,company,active,"Founded 2011 (some sources cite founders ex-MIT research scientists; Crunchbase/PitchBook list founders Janos Rohaly, Bill Yost, Kimo Johnson). HQ at 179 Bear Hill Road, Waltham, MA. Total funding ~$16.2M across 6 rounds (Crunchbase/Tracxn); most recent DISCLOSED round is $10M Series B led by Anzu Partners, announced Jan 2020 (investors also include Omega Funds). No publicly disclosed round after 2020. Digit 360 (announced Oct 2024 with Meta AI / FAIR) is a 360-degree artificial-fingertip tactile sensor with 18+ sensing features, detecting forces as low as 1 millinewton; Meta open-sources the code/designs. Partnership began with the original Digit sensor in 2021. Scope: borderline as a sensor component, but in_scope=true because the high-res tactile sensors exist specifically to enable learned robotic grasping/manipulation (AI-native tactile subsystem). Team size not disclosed publicly; growjo/LinkedIn estimates exist but not authoritative. Primary product line also serves non-AI industrial metrology/inspection (aerospace, forensics), but the assigned Digit 360 robotics use case is AI-native.","Sells vision-based tactile sensor hardware plus accompanying software/SDKs, spanning industrial 3D surface-inspection units (GelSight Mobile/Max for aerospace, automotive, oil & gas NDT and forensics) and research-grade robotic touch sensors (GelSight Mini, DIGIT, Digit 360); also earns OEM/manufacturing-and-distribution revenue by commercially producing sensors co-developed with Meta AI and through reseller partnerships (e.g., global reseller agreement with Hexagon).","Meta AI (co-development and manufacturing partner for DIGIT/Digit 360); Hexagon (global reseller partner). End markets include aerospace/defense MRO, automotive precision engineering, oil & gas inspection, law enforcement/forensics, and academic robotics labs; specific named paying end-customers are not publicly disclosed.","early-revenue (commercial hardware sold; ~$16.2M-$30.1M raised per Tracxn/PitchBook, $10M Series B led by Anzu Partners in 2020; exact revenue not publicly disclosed - unverified)","Pioneer and category-leader in elastomer/camera-based tactile sensing with micron-level spatial resolution and millinewton force sensitivity; Digit 360 adds 18+ sensing modalities and 360-degree fingertip coverage. Vs Meta's open-source DIGIT (which it manufactures) it offers higher-fidelity, productized industrial-grade sensors; vs PaXini and other tactile-array competitors its vision-based approach yields far higher spatial resolution at lower per-unit cost."
Ghost Robotics,"Vision 60, V60 Q-UGV",Philadelphia,US,2015,L4_hardware,L6_vertical,,core,"Builds rugged quadruped robots (Vision 60 Q-UGV) for defense, security, and inspection, using learned biomimetic blind-mode locomotion to traverse unstructured terrain without pre-mapped paths.",undisclosed (acquired; ~$240M transaction value for 60% stake at $400M enterprise value),240000000,acquisition (majority stake),2024-07,LIG Nex1 (with Korea Investment Private Equity),unknown,https://www.ghostrobotics.io/about-us,verified,company,active,"HQ Philadelphia, PA, USA; founded 2015. Maker of Vision 60 (V60) quadruped Q-UGV for defense/security/industrial inspection. Acquisition by South Korea's LIG Nex1 (defense) and Korea Investment Private Equity closed 2024-07-26: 60% controlling stake for ~$240M, $400M enterprise value; remainder funded by PE. Pre-acquisition venture funding was small/undisclosed. Now active as a US-based subsidiary of LIG Nex1. Assigned Layer 4 (AI-native legged hardware); secondary L6 (defense/security vertical). In-scope: legged-locomotion category is AI-native, relying on learned proprioceptive control policies. Team size not reliably found. Sources: ghostrobotics.io, Crunchbase, PR Newswire (acquisition close), The Robot Report, technical.ly.","Sells ruggedized Vision 60 and Spirit 40 quadruped unmanned ground vehicles (Q-UGVs) plus mission-specific payloads (e.g. manipulator arm, sensors, armed/EW modules) to militaries and government security buyers, primarily via direct hardware sales and defense procurement contracts. Now operates as the US legged-robotics arm of South Korean defense prime LIG Nex1 (60% owner), which feeds it manufacturing scale and weapons-integration pull-through.","U.S. Marine Corps, U.S. Army, and U.S. Air Force (notably Tyndall AFB perimeter security); also Department of Homeland Security/CBP border-patrol piloting, and commercial buyers in energy, data centers, and construction. Parent company LIG Nex1 is a strategic channel into South Korean and allied defense markets.","scaling (reportedly ~$40M+ annual sales and described as profitable at time of 2024 acquisition; acquired by LIG Nex1 for $240M at a ~$400M valuation, with a US IPO targeted for 2029)","Vs Boston Dynamics (Spot), Ghost positions on defense/tactical hardening rather than commercial inspection: sealed leg joints, field-repairable architecture, higher speed (~3.0 vs 1.6 m/s) and ~3x endurance, plus learned ""blind-mode"" proprioceptive locomotion that traverses terrain without relying on vision/LIDAR, and a willingness to support armed/military payloads Boston Dynamics prohibits. Vs Unitree (Go2/B2), Ghost differentiates on military-grade ruggedization and defense integration rather than low-cost consumer/industrial volume; Boston Dynamics' 2022 patent suit against Ghost was settled confidentially."
Hanson Robotics,"Hanson Robotics Limited (Sophia, Desdemona)",Hong Kong,HK,2007,L4_hardware,L6_vertical,,core,"Builds expressive humanoid social robots (Sophia) with lifelike faces for engagement, research, and entertainment; conversation relies on external/third-party AI rather than an in-house foundation model.",~15000000,14500000,Series B,2018-03,undisclosed,51-200 (~58),https://en.wikipedia.org/wiki/Hanson_Robotics,verified,company,active,"Founded 2007 in Dallas, TX (US) by David Hanson; relocated HQ to Hong Kong Science Park in 2013. Best known for Sophia (activated Feb 2016) and Desdemona social humanoids. Layer 4 AI-native hardware: hardware-first expressive humanoid maker. Total funding lightly documented; Crunchbase/PitchBook list a $14.5M Series B (March 2018) as the most recent disclosed round; lead investor not clearly disclosed. Team ~58 (getlatka) / 51-200 (LinkedIn). David Hanson is also co-founder of SingularityNET; the two entities are closely linked. In scope: general-purpose social humanoid, AI-native category.","Sells/leases expressive humanoid robots and licenses its Frubber skin and robotics platform: full-scale robots (Sophia, Grace) are leased for corporate/conference appearances (reported ~$50K-$250K per engagement) and research/exhibition partnerships, while consumer/STEM units like Little Sophia (~$149) are sold to teach kids to code. Grace, a healthcare/eldercare android, targets sales to medical and care institutions.","Largely undisclosed; buyers are mostly conference organizers, universities/research labs, museums, and media/event producers hiring Sophia for appearances. Grace was positioned for healthcare and eldercare facilities (COVID-era), but no named paying institutional customers are publicly confirmed.","early-revenue (~$5.8M cumulative reported by GetLatka, unverified; ~$21.7M raised in funding)","Patented Frubber nanotech skin over a face-actuator system gives Sophia ~60 lifelike expressions, positioning it as a ""social/personality"" robot brand vs Engineered Arts' Ameca (silicone skin, more degrees of facial freedom, focused on entertainment/exhibition) and Realbotix (companion/lifelike androids). Differentiation is brand recognition (Sophia as a media icon) and expressive realism rather than autonomous conversation, which relies on external/third-party LLMs and scripting."
Hiwonder,"LeArm AI; NexArm; Shenzhen Hiwonder Technology Co., Ltd.",Shenzhen,CN,2015,L4_hardware,,,division,"Sells AI-native research manipulators (NexArm, LeArm AI, LeRobot SO-ARM101) with dual-camera vision and leader-follower sync for imitation/RL data collection and embodied-intelligence learning.",1570000,undisclosed,unknown,unknown,Bell Tech Education,~50,https://www.hiwonder.com/products/lerobot-so-101,verified,company,active,"Shenzhen Hiwonder Technology Co., Ltd. is primarily a STEAM-education and open-source robotics vendor (40+ patents, 80+ countries). The AI-native research manipulators (NexArm leader-follower arm, LeArm AI, and the LeRobot SO-ARM101) are a product line built for embodied-intelligence research: dual-camera vision, millisecond leader/follower sync, integrated with Hugging Face LeRobot for imitation learning, RL, and validation against community pre-trained models. NexArm uses ESP32+AT32 dual-chip architecture with inverse-kinematics and end-to-end large-model validation. core_or_division=division because the AI-native learning hardware is one line within a broader education-robotics business; the company does not build a foundation model. Funding ~$1.57M (PitchBook/Tracxn), investor Bell Tech Education; round size/type/date undisclosed. Team size ~50 per PitchBook. Founded year 2015 per company About page and LinkedIn (one source noted 2012; company self-reports 2015). In_scope=true: the research-arm category is AI-native (built specifically for learned-policy data collection and validation) and would not exist in this form without imitation/RL learning workflows.","Sells low-cost open-source AI/embodied-intelligence robotic arm kits (NexArm, LeArm AI, LeRobot SO-ARM101, ~$254+ per kit, leader-follower pairs for imitation/RL data collection) plus broader STEAM robotics kits, servos, sensors and curriculum, sold direct via hiwonder.com and through resellers (Amazon, Seeed Studio, RobotShop, OZ Robotics) in 80+ countries. Revenue is hardware unit sales with bulk/institutional pricing.","Primarily education and research buyers: per company claims, products are used in 2,000+ schools and institutions and by 300,000+ teachers and students across 80+ countries; specific named paying organizations are not publicly disclosed. Distribution partners include Seeed Studio, RobotShop, Amazon, and OZ Robotics.","early-revenue (third-party estimate US$5M-US$10M revenue, ~50 employees, $1.57M raised from Bell Tech Education per PitchBook/RocketReach - unverified)","Differentiates on being among the lowest-cost, deeply LeRobot-compatible manipulators with dual-camera (gripper + external) vision, magnetic-encoder bus servos, and turnkey leader-follower teleoperation for imitation/RL data collection, plus its own NexArm ESP32+AT32+K230 (6 TOPS) stack. Vs closest named competitors Seeed Studio (which sells the bare SO-ARM101 servo kit it co-distributes) and The Robot Studio / Hugging Face reference SO-ARM designs, Hiwonder adds assembled, vision-integrated, curriculum-bundled kits rather than DIY-only hardware - largely an execution/cost play on a shared open-source design."
Inspire Robots,"INSPIRE-ROBOTS; 因时机器人; Beijing Inspire Robots Technology Co., Ltd.",Beijing,CN,2016,L4_hardware,,,core,Builds China's first mass-produced five-finger dexterous hands and micro linear servo actuators used as tactile end-effectors and components on humanoid and learned-manipulation robots.,undisclosed,undisclosed (several hundred million RMB combined),Series C (C1 and C2),2026-02,C1: China Mobile Chain Leader Fund & Shenzhen Capital Group; C2: Beijing AI Industry Investment Fund,unknown,https://autonews.gasgoo.com/articles/news/seeds-the-dexterous-hand-featured-on-the-spring-festival-gala-just-raised-hundreds-of-millions-in-yuan-2026617930660212737,verified,company,active,"Founded May 2016 in Beijing as Beijing Inspire Robots Technology Co., Ltd. (Intime Robotics). Makes micro linear servo actuators and RH56/FTP five-finger dexterous hands (FTP series integrates 17 tactile sensors, fingertip force up to 3kg, 1M+ cycle lifespan). 2025 annual deliveries topped 10,000 dexterous hand units; product featured in 2026 Year of the Horse CCTV Spring Festival Gala. Feb 24 2026 announced C1 and C2 rounds totaling several hundred million RMB; C1 co-led by China Mobile Chain Leader Fund and Shenzhen Capital Group (with Boyuan, Fortune, Primavera); C2 led by Beijing AI Industry Investment Fund (with Qiming, Boyuan, Primavera, Jinshi, TCL Ventures). Primary layer L4 AI-Native Hardware. In scope: tactile dexterous hands/actuators are end-effectors for learned AI manipulation on humanoids; not its own foundation model. Total funding USD, exact round sizes in USD, and team size not disclosed.","Sells mass-produced five-finger dexterous hands (RH56 series, ~RMB 30,000-48,000 / ~USD 3,000-8,000 per unit) plus micro linear servo actuators and electric grippers as components to humanoid robot OEMs, industrial automation firms, and research institutions; also operates an online store for direct/distributor sales. Revenue is hardware unit sales of end-effectors and motion-control parts.","100+ customers (per company). Named: Unitree (宇树), UBTech (优必选), AgiBot/Zhiyuan (智元), Galbot/Galaxy General (银河通用), Skild AI, CATL, ATL, BYD, Ecovacs (科沃斯); plus universities and research institutes in China, Europe, and the US.","scaling (early-revenue commercialized since 2020; cumulative dexterous-hand shipments surpassed 1,000 units by Sept 2024 and reportedly crossed ~10,000 units in 2025; claims ~50% domestic market share; specific revenue figure not publicly disclosed - third-party USD 30-80M estimate unverified)","First in China to commercialize and mass-produce humanoid-grade five-finger dexterous hands, vertically integrating its own micro linear servo actuators to drive prices down to the ~RMB 30k-48k tier, far below Zhejiang BrainCo (强脑科技) BrainRobotics at ~RMB 108k. Competes on cost/volume and component integration vs Linker Hand / 灵心巧手 (~RMB 49.9k, higher DoF) and parts supplier Zhaowei (兆威机电), which sells hollow-cup motors rather than complete hands."
Kepler Robotics,"Kepler Exploration Robot; Shanghai Kepler Robot Co., Ltd; Keplerbot",Shanghai,CN,2023,L4_hardware,L6_vertical,,core,"Builds industrial general-purpose humanoid robots (K2 'Bumblebee', hybrid architecture) with full-stack self-developed actuators, dexterous hands and learned motion-control policies to address labor shortages.",~14600000,undisclosed,Series A,2026-04,undisclosed,unknown,https://www.gotokepler.com/,verified,company,active,"Founded Aug 2023 by Yang Hua (founder of Xiaomi smart-home supplier Chunmi Tech) and Hu Debo, HQ Shanghai Pudong. Builds full-stack legged/humanoid platforms (Forerunner series, K2 'Bumblebee' hybrid-architecture industrial humanoid; claimed world's first commercially available hybrid-architecture humanoid, mass production Sept 2025). 80% self-sufficiency in core components incl. self-developed rotary/linear actuators, six-axis force sensors, dexterous hands, and learned motion-control policies => AI-native hardware (L4). Also operates as L6 industrial/manufacturing vertical deployment (auto plant tasks). In-scope: general-purpose humanoid driven by learned policies, would not exist without robot learning. Funding: total ~$14.6M reported by Tracxn over 2 rounds (first round Apr 2025, Series A Apr 2026); figures uncertain. Separately, Hangzhou Kelin Electric (A-share listed) acquiring controlling 51% stake (9.43% closed Dec 31 2025 for ~CNY100M; further 41.57% for up to CNY300M), implying ~CNY720M valuation — status still active as operating subsidiary, not shut down. Distinct from Galaxea. Team size not found. Sources: PRNewswire (K2 Bumblebee IROS 2025 / mass production), Tracxn, Crunchbase, Gasgoo/Yicai (Kelin acquisition).","Sells full-size industrial humanoid robots, primarily the K2 ""Bumblebee"" priced around RMB 248,000 (~$35K) per unit, to factories and logistics operators, plus framework/volume purchase agreements; also supplies units to universities for R&D/education. Scenario-driven model: deploys robots into real industrial tasks (auto manufacturing, logistics, welding) to accumulate data and iterate, then scales delivery.","Mostly unnamed: orders from ""multiple automotive companies"" for logistics and five universities for research/education; framework agreements covering several thousand units (hundreds of millions of yuan) across logistics, manufacturing and exhibitions. Specific named paying customers are not publicly disclosed. Now majority-controlled/strategically invested by A-share listed firm Hangzhou Kelin (per Gasgoo).","early-revenue (FY2025 revenue 4.34M CNY, net loss 66.94M CNY; Q1 2026 revenue 2.64M CNY, loss 17.09M CNY per controlling shareholder Hangzhou Kelin disclosures)","vs UBTech (Walker S) and Unitree (G1/H1): all three are Chinese full-stack players, but Kepler differentiates on a hybrid serial-parallel mechanical architecture combining roller-screw linear actuators with rotary actuators for high stiffness/low backlash and an aggressively low industrial price point, plus a hybrid local+cloud compute approach. UBTech and Unitree instead emphasize vertically integrated proprietary rotary servo actuators; differentiation is real on architecture but modest, competing largely on cost, deployment speed and capital."
Leju Robotics,"Leju Robot; KUAVO; Kuafu; 乐聚机器人; Leju (Shenzhen) Robotics Technology Co., Ltd.",Shenzhen,CN,2016,L4_hardware,L6_vertical,,core,"Builds full-size KUAVO/Kuafu humanoid robots for industrial, education and service use, running on Huawei's HarmonyOS and Pangu embodied-intelligence model rather than an in-house foundation model.",undisclosed (multiple rounds incl. Series B and ~$210M pre-IPO; cumulative not consolidated),~210000000,pre-IPO,2025-10,"undisclosed (participants: CITIC Goldstone, Shenzhen Investment Holdings, Tencent, Shenzhen Capital Group)",unknown,https://www.lejurobot.com/en,verified,company,active,"Founded 2016 by a Harbin Institute of Technology (HIT) team; HQ Shenzhen, Guangdong. Hardware-first general-purpose humanoid maker (KUAVO / Kuafu line, KUAVO 5 modular). Fits Layer 4 AI-Native Hardware: relies on third-party Huawei Pangu embodied-intelligence model and HarmonyOS for the AI ""brain"" and contributes data to external VLA/embodied datasets rather than building its own foundation model. General-purpose humanoid = AI-native category => in_scope=true. Pre-IPO round Oct 2025 raised ~RMB 1.5B (~$207-210M); investors include Tencent, Shenzhen Capital Group, CITIC Goldstone, Shenzhen Investment Holdings, Dongfang Precision, Tuopu Group, China-US Green Fund. Lead investor of the pre-IPO round not clearly identified. Sources: Wikipedia (Leju Robot), Bloomberg/DealStreetAsia/RoboticsAndAutomationNews (Oct 2025 round), Huawei Central / WAIC coverage (Pangu + HarmonyOS integration), company site lejurobot.com.","Sells full-size KUAVO humanoid robots via direct unit sales across three tiers, with data-collection units (45% of 2025 revenue) and scientific-research/education units (32.5%) as the largest segments, plus commercial-service deployments (18.7%); also sells lower-cost AELOS education kits and Roban robots to schools. 2025 revenue ~RMB 258M (~$36M).","Nio (validating KUAVO at its EV factory) and Jiangsu Hengtong Group (factory pilot); AELOS education robots deployed at 4,000+ schools/institutions nationwide, including a Sichuan school; partnered with Huawei's embodied-AI center. Delivered 100+ full-size humanoids by 2025.","early-revenue (2025 operating revenue ~RMB 258M / ~$36M; pre-IPO, targeting Shanghai STAR/ChiNext listing)","Differentiates by being China's first open-source HarmonyOS humanoid running Huawei's Pangu embodied-AI model, giving Pangu access without separate licensing costs, vs Unitree (ultra-low-cost, ~$5,500 R1) and UBTech/Fourier; competes more on the Huawei/HarmonyOS ecosystem lock-in and discount pricing than on hardware leadership."
LimX Dynamics,逐际动力 (Zhiji Dongli),Shenzhen,CN,2022,L4_hardware,"L1_foundation_model,L5_middleware",,core,Develops full-size general-purpose humanoid and bipedal robots powered by learning-based motion-control foundation models and an agentic operating system (COSA) for autonomous tasks in dynamic environments.,~272000000,200000000,Series B,2026-02,"Stone Venture (no single lead disclosed; multiple investors including JD, Oriental Fortune Capital, CoStone Capital)",unknown,https://www.therobotreport.com/limx-dynamics-raises-200m-for-humanoid-robot-expansion/,verified,company,active,"Founded January 2022, HQ Shenzhen. Series B $200M announced Feb 2026 with participation from Stone Venture, JD.com, Oriental Fortune Capital, CoStone Capital, plus existing shareholders NIO Capital, Shangqi Capital (SAIC), Future Capital; no single lead clearly disclosed. Prior Series A (~July 2024) led by China Merchants Venture Capital and Shangqi Capital. Products: Oli full-size humanoid, TRON 1/TRON 2 bipedal platforms; software COSA (Cognitive OS of Agents) plus motion-control foundation models. Total funding ~$272M (some sources cite up to $296M). Qualifies for L1: builds general learning-based locomotion/manipulation foundation models for its own robots.","Sells full-size general-purpose humanoid robots (Oli, from ~RMB 158,000/$22,730) and modular bipedal/development platforms (TRON 1, TRON 2) to research labs, robotics developers, and systems integrators, plus its COSA agentic operating system and motion-control foundation models as the embodied-intelligence ""brain"" layer. Positions itself as a platform company (hardware + software product ladder) rather than a hardware-only vendor, with commercial/service deployments via strategic partners.","JD.com is both a strategic investor and intended customer, planning to deploy LimX humanoids across its supply chain and retail operations; other strategic partners/investors include Alibaba and auto-parts supplier Zhongding Group. Most buyers to date are AI researchers, robotics developers, and systems integrators purchasing TRON/Oli platforms; specific named paying enterprise deployments are otherwise undisclosed.","early-revenue (Oli began taking pre-orders July 2025 from ~RMB 158,000; TRON dev platforms sold commercially; specific revenue figures not publicly disclosed)","Differentiates from Unitree and AgiBot (Zhiyuan) — the two leading Chinese humanoid shippers — by bundling a learning-based whole-body motion-control foundation model with COSA, a ""physical-world-native"" agentic operating system, and a tiered hardware ladder (TRON 1/2 to full-size Oli) rather than competing mainly on low-cost hardware as Unitree does. Versus US rivals like Figure, it emphasizes a cheaper, developer-accessible China-manufactured platform plus open agentic OS."
